536,0,поэзии тон өөрсэ шэнжэтэй,P O E ZJ II <SPACE> T O NG <SPACE> OOs R S EH <SPACE> SH E N ZH EH T EE,id_0_0536
538,0,дуудан дуулан зогсон байнаб,D UUh D EH NG <SPACE> D UUh L EH NG <SPACE> Z O K S EH NG <SPACE> B EE N EH P,id_0_0538
543,0,эрэ хүн поездруу хүрин дэгэл соо оробо,E R EH <SPACE> H Us NG <SPACE> P O J E Z D R UUh <SPACE> H Us RJ I NG <SPACE> D E Gr EH L <SPACE> S OOh <SPACE> O R O V EH,id_0_0543
544,0,намдаа ши мүрөө нэнгүүлыш даа,N A M D AA <SPACE> SH Y <SPACE> M Us R OOs <SPACE> N E NG G UUs L Y SH <SPACE> D AA,id_0_0544
545,0,матти ажалаа мүүнөөдэр хэжэ дууһаха еһотой,M A T TJ I <SPACE> A ZH EH L AA <SPACE> M UUs N OOs D EH R <SPACE> H E ZH EH <SPACE> D UUh HH EH H EH <SPACE> J O HH EH T EE,id_0_0545
546,0,ехэ хабсагайнай хажуудахи харгы,J E H EH <SPACE> H A P S EH Gr EE N EE <SPACE> H A ZH UUh D EH HJ I <SPACE> H A R Gr Y,id_0_0546
547,0,одоол харагдаһан газараа харлан гэжэ нэрлэбэ,O D OOh L <SPACE> H A R EH G D EH HH EH NG <SPACE> G A Z EH R AA <SPACE> H A R L EH NG <SPACE> G E ZH EH <SPACE> N E R L EH V EH,id_0_0547
548,0,хуйтэн хату нэгэн уедэ,H UIs T EH NG <SPACE> H A T Uh <SPACE> N E Gr EH NG <SPACE> Uh J EH D EH,id_0_0548
549,0,мааттида шэнэ түмэр морин,M AA T TJ I D EH <SPACE> SH E N EH <SPACE> T Us M EH R <SPACE> M O RJ I NG,id_0_0549
550,0,булта бүһэтэй зон толгойгороо һэжэрээ,B Uh L T EH <SPACE> B Us HH EH T EE <SPACE> Z O NG <SPACE> T O L Gr EE Gr O R OOh <SPACE> HH E ZH EH R EE,id_0_0550
552,0,аза шадалтайхан болохо дуратайлди,A Z EH <SPACE> SH A D EH L T EE H EH NG <SPACE> B O L EH H EH <SPACE> D Uh R EH T EE L DJ I,id_0_0552
553,0,бугуйбша богжын орондо,B Uh Gr UIh P SH EH <SPACE> B O G ZH Y NG <SPACE> O R EH N D EH,id_0_0553
554,0,холын замда эхын ёһоор юрөөжэ,H O L Y NG <SPACE> Z A M D EH <SPACE> E H Y NG <SPACE> J O HH OOh R <SPACE> J Uh R OOs ZH EH,id_0_0554
555,0,тэнгэри шэнги ужам тэбшээритээдэнь,T E NG G EH RJ I <SPACE> SH E NG GJ I <SPACE> Uh ZH EH M <SPACE> T E P SH EE RJ I T EE D EH NJ,id_0_0555
556,0,майин нүхэр туркуһаань бусахань,M EE J NG <SPACE> N Us H EH R <SPACE> T Uh R K Uh HH AA NJ <SPACE> B Uh S EH H EH NJ,id_0_0556
557,0,олон олоной нэгэниинь болоһон,O L EH NG <SPACE> O L EH N EE <SPACE> N E Gr EH NJ II NJ <SPACE> B O L EH HH EH NG,id_0_0557
558,0,баяраа хүргэнэб гараа һарбайнаб,B A J A R AA <SPACE> H Us R Gr EH N EH P <SPACE> G A R AA <SPACE> HH A R V EE N EH P,id_0_0558
559,0,жаахан шара эмгэн гэлээшье,ZH AA H EH NG <SPACE> SH A R EH <SPACE> E M Gr EH NG <SPACE> G E L EE SH J EH,id_0_0559
560,0,сонхоной хойно хүхэ юумэн харагдажа байгаа,S O N H EH N EE <SPACE> H OE N EH <SPACE> H Us H EH <SPACE> J UUh M EH NG <SPACE> H A R EH G D EH ZH EH <SPACE> B EE Gr AA,id_0_0560
561,0,бурхандаа мургэнэб тэнгэридээ зальбарнаб,B Uh R H EH N D AA <SPACE> M Uh R Gr EH N EH P <SPACE> T E NG G EH RJ I D EE <SPACE> Z A LJ V EH R N EH P,id_0_0561
562,0,шиниимнии зангыш һануулна,SH Uh NJ II M NJ I <SPACE> Z A NG G Y SH <SPACE> HH A N UUh L N EH,id_0_0562
563,0,сэдьхэлдэмнай хэзээдэшье зулгы,S E TJ H EH L D EH M N EE <SPACE> H E Z EE D EH SH J EH <SPACE> Z Uh L Gr Y,id_0_0563
566,0,аха захаяа харан һургуулиин удэ нээжэ ородог,A H EH <SPACE> Z A H A J AA <SPACE> H A R EH NG <SPACE> HH Uh R Gr UUh LJ II NG <SPACE> Uh D EH <SPACE> N EE ZH EH <SPACE> O R EH D EH K,id_0_0566
567,0,тойроод намарай ой арюун сэбэр уһатай гол,T OE R OOh T <SPACE> N A M EH R EE <SPACE> OE <SPACE> A RJ UUh NG <SPACE> S E V EH R <SPACE> Uh HH EH T EE <SPACE> G O L,id_0_0567
568,0,дурланаб удэр бури шамдаа дурланаб,D Uh R L EH N EH P <SPACE> Uh D EH R <SPACE> B Uh RJ I <SPACE> SH A M D AA <SPACE> D Uh R L EH N EH P,id_0_0568
569,0,нангин сэбэр шинии хайра,N A NG GJ I NG <SPACE> S E V EH R <SPACE> SH Uh NJ II <SPACE> H EE R EH,id_0_0569
570,0,хамтадаа баймаар байна хоюулаа,H A M T EH D AA <SPACE> B EE M AA R <SPACE> B EE N EH <SPACE> H O J UUh L AA,id_0_0570
571,0,бурханай еһоор тэнжэһэн,B Uh R H EH N EE <SPACE> J O HH OOh R <SPACE> T E N ZH EH HH EH NG,id_0_0571
572,0,эрэшуулэй худал унэн угэдэнь орожо,E R EH SH UUh L EE <SPACE> H Uh D EH L <SPACE> Uh N EH NG <SPACE> Uh Gr EH D EH NJ <SPACE> O R O ZH EH,id_0_0572
573,0,найгажа ябаһан уе энэ хундэ бии,N EE Gr EH ZH EH <SPACE> J A V EH HH EH NG <SPACE> Uh J EH <SPACE> E N EH <SPACE> H Uh N D EH <SPACE> B Y,id_0_0573
574,0,эгэлын эгэл энэ хуниие би шутэдэг хум,E Gr EH L Y NG <SPACE> E Gr EH L <SPACE> E N EH <SPACE> H Uh NJ II J EH <SPACE> BJ I <SPACE> SH Uh T EH D EH K <SPACE> H Uh M,id_0_0574
576,0,нойтон гутал нарай тугал,N OE T EH NG <SPACE> G Uh T EH L <SPACE> N A R EE <SPACE> T Uh Gr EH L,id_0_0576
577,0,тогтоол ноябрь һарада табигдаһаан байна,T O K T OOh L <SPACE> N O J A B RJ <SPACE> HH A R EH D EH <SPACE> T A VJ I G D EH HH AA NG <SPACE> B EE N EH,id_0_0577
578,0,энэ ажал мүүнөөдэр хэгдэжэ дууһаха еһотой,E N EH <SPACE> A ZH EH L <SPACE> M UUs N OOs D EH R <SPACE> H E G D EH ZH EH <SPACE> D UUh HH EH H EH <SPACE> J O HH EH T EE,id_0_0578
579,0,нелмосаа гартар чальчаж суундаа,NJ E L M O S AA <SPACE> G A R T EH R <SPACE> CH A LJ CH A SH <SPACE> S UUh N D AA,id_0_0579
580,0,тэбшээриин хураар тэжээгдэн ургаһан,T E P SH EE RJ II NG <SPACE> H Uh R AA R <SPACE> T E ZH EE G D EH NG <SPACE> Uh R Gr EH HH EH NG,id_0_0580
581,0,эрбээхэй шэнги эрьежэ эрбэлзэжэ байхадаа,E R V EE H EE <SPACE> SH E NG GJ I <SPACE> E RJ J EH ZH EH <SPACE> E R V EH L Z EH ZH EH <SPACE> B EE H EH D AA,id_0_0581
582,0,тиин тэрэ газараа худалдажа абааб,TJ II NG <SPACE> T E R EH <SPACE> G A Z EH R AA <SPACE> H Uh D EH L ZH EH <SPACE> A V AA P,id_0_0582
584,0,эхэ хун олоншье намайе,E H EH <SPACE> H Uh NG <SPACE> O L EH N SH J EH <SPACE> N A M EE J EH,id_0_0584
585,0,зохёогшо һонирхолтойгоор хөөрэдэг һэн,Z O HJ OOh K SH EH <SPACE> HH O NJ I R H EH L T EE Gr OOh R <SPACE> H OOs R D EH D EH K <SPACE> HH EH NG,id_0_0585
586,0,турэл арадайм домогшул,T Uh R EH L <SPACE> A R EH D EE M <SPACE> D O M EH K SH Uh L,id_0_0586
587,0,хоер үхибүүд хойно хойноһоонь түрөө,H O J EH R <SPACE> Us HJ I V UUs T <SPACE> H OE N EH <SPACE> H OE N OOh HH OOh NJ <SPACE> T Us R OOs,id_0_0587
588,0,афганистан хадаа уулархаг орон мүн,A F G A NJ I S T A N <SPACE> H A D AA <SPACE> UUh L EH R H EH K <SPACE> O R EH NG <SPACE> M Us NG,id_0_0588
589,0,ариг сэбэрээ сахижаһүр һүлдөө бодхоое,A RJ I K <SPACE> S E V EH R EE <SPACE> S A HJ I ZH EH HH Us R <SPACE> HH Us L D OOs <SPACE> B O T H OOh J EH,id_0_0589
590,0,сэбэр нангин этигэл турөө,S E V EH R <SPACE> N A NG GJ I NG <SPACE> E TJ I Gr EH L <SPACE> T Uh R OOs,id_0_0590
591,0,үргэн үйлсэ гудамжынь үдэшын сагта сэнгэлигүш һаа,Us R Gr EH NG <SPACE> UIs L S EH <SPACE> G Uh D EH M ZH Y NJ <SPACE> Us D EH SH Y NG <SPACE> S A G T EH <SPACE> S E NG G EH LJ II G Us SH <SPACE> HH AA,id_0_0591
592,0,би мүнөө эхэ эсэгынгээл буянгаар ажаһуунаб,BJ I <SPACE> M Us N OOs <SPACE> E H EH <SPACE> E S EH Gr Y NG G EE L <SPACE> B Uh J EH NG G AA R <SPACE> A ZH EH HH UUh N EH P,id_0_0592
593,0,хаража ябаарай нухэрни,H A R EH ZH EH <SPACE> J A V AA R EE <SPACE> N Uh H EH R NJ I,id_0_0593
595,0,эльгэлэн досоом дурсагдаад,E LJ G EH L EH NG <SPACE> D O S OOh M <SPACE> D Uh R S EH G D AA T,id_0_0595
596,0,ээрэм талын худоогэй ганса убэлжоон дээрэ,EE R EH M <SPACE> T A L Y NG <SPACE> H Uh D OOh Gr EE <SPACE> G A N S EH <SPACE> Uh V EH L ZH OOh NG <SPACE> D EE R EH,id_0_0596
597,0,намаа сэсэгүүд ганхахал,N A M AA <SPACE> S E S EH Gr UUs T <SPACE> G A N H EH H EH L,id_0_0597
599,0,нюдэнсоошни гомдол харанаб,NJ Uh D EH N S OOh SH NJ I <SPACE> G O M D EH L <SPACE> H A R EH N EH P,id_0_0599
600,0,намайе минии аха дуунэрые хун бологохо гэжэ,N A M EE J EH <SPACE> MJ I NJ II <SPACE> A H EH <SPACE> D UUh N EH R Y J EH <SPACE> H Uh NG <SPACE> B O L EH G EH H EH <SPACE> G E ZH EH,id_0_0600
601,0,удын сайн холодохые даахаяа болёо,Uh D Y NG <SPACE> S EE NG <SPACE> H O L EH D EH H Y J EH <SPACE> D AA H EH J AA <SPACE> B O LJ OOh,id_0_0601
602,0,халуун зүрхэм бусалжа байна,H A L UUh NG <SPACE> Z Us R H EH M <SPACE> B Uh S EH L ZH EH <SPACE> B EE N EH,id_0_0602
603,0,танай һанал бодолнууд ехэ һайшаалтай,T A N EE <SPACE> HH A N EH L <SPACE> B O D EH L N UUh T <SPACE> J E H EH <SPACE> HH EE SH AA L T EE,id_0_0603
604,0,тогооной архи айл бүхэн нэрэнэ,T O Gr OOh N EE <SPACE> A R HJ I <SPACE> EE L <SPACE> B Us H EH NG <SPACE> N E R EH N EH,id_0_0604
605,0,шэдитэ буряадайм нютагуудаар,SH E DJ I T EH <SPACE> B Uh RJ AA D EE M <SPACE> NJ Uh T EH Gr UUh D AA R,id_0_0605
606,0,замбиин залаа барилсаха заяатай хүбүүн,Z A M BJ I NG <SPACE> Z A L AA <SPACE> B A RJ I L S EH H EH <SPACE> Z A J AA T EE <SPACE> H Us V UUs NG,id_0_0606
607,0,ши намда өөрын хүн болонхой байналши,SH Y <SPACE> N A M D EH <SPACE> OOs R Y NG <SPACE> H Us NG <SPACE> B O L EH N H EE <SPACE> B EE N EH L SH Y,id_0_0607
608,0,өөрөөшье мэдэнгүй артист болошооб,OOs R OOs SH J EH <SPACE> M E D EH NG G UIs <SPACE> A R TJ I S T <SPACE> B O L EH SH OOh P,id_0_0608
609,0,дулаан амисхаалаар намайе һэрюулээш,D Uh L AA NG <SPACE> A MJ I S H AA L AA R <SPACE> N A M EE J EH <SPACE> HH E RJ UUh L EE SH,id_0_0609
610,0,хүхэ тэнгэриин майхан дор,H Us H EH <SPACE> T E NG G EH RJ II NG <SPACE> M EE H EH NG <SPACE> D O R,id_0_0610
611,0,утаһаарынь хэмжэжэ шахажа байгаа,Uh T EH HH AA R Y NJ <SPACE> H E M ZH EH ZH EH <SPACE> SH A H EH ZH EH <SPACE> B EE Gr AA,id_0_0611
612,0,үхибүүдтэ зорюулагдаһан зохеолнууд,Us HJ I V UUs T T EH <SPACE> Z O RJ UUh L EH G D EH HH EH NG <SPACE> Z O HJ OOh L N UUh T,id_0_0612
613,0,нажарлажа амиды наһан соогоо жаргаг лэ,N A ZH EH R L EH ZH EH <SPACE> A MJ I D Y <SPACE> N A HH EH NG <SPACE> S OOh Gr OOh <SPACE> ZH A R Gr EH K <SPACE> L EH,id_0_0613
614,0,омог басаган намда нигэжэ,O M EH K <SPACE> B A S EH Gr EH NG <SPACE> N A M D EH <SPACE> NJ I Gr EH ZH EH,id_0_0614
615,0,тэмээгээр орон газар ошожо,T E M EE Gr EE R <SPACE> O R EH NG <SPACE> G A Z EH R <SPACE> O SH EH ZH EH,id_0_0615
616,0,хайлгана шубуунай уйлахада,H EE L Gr EH N EH <SPACE> SH Uh V UUh N EE <SPACE> UIh L EH H EH D EH,id_0_0616
617,0,алтан дайдаяа аршалхаа ошое,A L T EH NG <SPACE> D EE D EH J AA <SPACE> A R SH EH L H AA <SPACE> O SH EH J EH,id_0_0617
620,0,сагаан гурил хээтэй торгонһоо унэтэй байгаа,S A Gr AA NG <SPACE> G Uh RJ I L <SPACE> H EE T EE <SPACE> T O R Gr EH N HH OOh <SPACE> Uh N EH T EE <SPACE> B EE Gr AA,id_0_0620
621,0,тэрэ жэлнууд уймоотэ наймаан дээрээ,T E R EH <SPACE> ZH E L N UUh D <SPACE> UIh M OOh T EH <SPACE> N EE M AA NG <SPACE> D EE R EE,id_0_0621
622,0,саяан хадын сэлгеэн амяар арюудхан,S A J AA NG <SPACE> H A D Y NG <SPACE> S E L Gr EE NG <SPACE> A MJ AA R <SPACE> A RJ UUh D H EH NG,id_0_0622
623,0,мартан угыхэн нютагаа ябана гэжэ элил омогорхохоор лэ,M A R T EH NG <SPACE> Uh Gr Y H EH NG <SPACE> NJ Uh T EH Gr AA <SPACE> J A V EH N EH <SPACE> G E ZH EH <SPACE> E LJ I L <SPACE> O M EH Gr EH R H EH H OOh R <SPACE> L EH,id_0_0623
624,0,айхабтар наринаар нангинаар зураглажа шадана,EE H EH P T EH R <SPACE> N A RJ I N AA R <SPACE> N A NG GJ I N AA R <SPACE> Z Uh R EH G L EH ZH EH <SPACE> SH A D EH N EH,id_0_0624
625,0,угаа һайхан тунгалаг уһан,Uh Gr AA <SPACE> HH EE H EH NG <SPACE> T Uh NG G EH L EH K <SPACE> Uh HH EH NG,id_0_0625
626,0,теэд сагай хүшэртэ дарагдаад,TJ EE T <SPACE> S A Gr EE <SPACE> H Us SH EH R T EH <SPACE> D A R EH G D AA T,id_0_0626
627,0,харин газарта хара хуйтэн нойтон соо,H A RJ I NG <SPACE> G A Z EH R T EH <SPACE> H A R EH <SPACE> H UIs T EH NG <SPACE> N OE T EH NG <SPACE> S OOh,id_0_0627
628,0,сэнхир талын үргэниие,S E N HJ I R <SPACE> T A L Y NG <SPACE> Us R Gr E NJ II J EH,id_0_0628
629,0,эзэгуй улэһэн абымни орон дээрэ,E Z EH Gr UIs <SPACE> Uh L EH HH EH NG <SPACE> A V Y M NJ I <SPACE> O R EH NG <SPACE> D EE R EH,id_0_0629
630,0,би гурбан пүмпөөдэһөөнь арсалааб,BJ I <SPACE> G Uh R V EH NG <SPACE> P Us M P OOs D EH HH OOs NJ <SPACE> A R S EH L AA P,id_0_0630
631,0,гансал шамай наһан соогоо,G A N S EH L <SPACE> SH A M EE <SPACE> N A HH EH NG <SPACE> S OOh Gr OOh,id_0_0631
632,0,һэеыгээр хайшалаатай унэгэн ши,HH E J Y Gr EE R <SPACE> H EE SH EH L AA T EE <SPACE> Uh N EH Gr EH NG <SPACE> SH Y,id_0_0632
633,0,умдалхын амтата аршаан бии,Uh M D EH L H Y NG <SPACE> A M T EH T EH <SPACE> A R SH AA NG <SPACE> B Y,id_0_0633
634,0,яруу найрагые буувэйлэн ундылгэһэн юм,J A R UUh <SPACE> N EE R EH Gr Y J EH <SPACE> B UUh V EE L EH NG <SPACE> Uh N D Y L Gr EH HH EH NG <SPACE> J Uh M,id_0_0634
636,0,жэлнүүд һубарин ошонол даа,ZH E L N UUs T <SPACE> HH Uh V EH RJ I NG <SPACE> O SH EH N EH L <SPACE> D AA,id_0_0636
637,0,диилэнхи шажан лалын шажан,DJ II L EH N H I <SPACE> SH A ZH EH NG <SPACE> L A L Y NG <SPACE> SH A ZH EH NG,id_0_0637
638,0,үнгын дайдаар хангай тайгаар нэмжыгшэ,Us NG G Y NG <SPACE> D EE D AA R <SPACE> H A NG G EE <SPACE> T EE Gr AA R <SPACE> N E M ZH Y Gr SH EH,id_0_0638
640,0,шэдитэ аргын шанга хүсэндэ оройгдооб,SH E DJ I T EH <SPACE> A R Gr Y NG <SPACE> SH A NG G EH <SPACE> H Us S EH N D EH <SPACE> O R EE G D OOh P,id_0_0640
641,0,тохойн шэнээхэн нялхадамни,T O H EE NG <SPACE> SH E N EE H EH NG <SPACE> NJ A L H EH D EH M NJ I,id_0_0641
642,0,һайн мориндо эзэн олон һайн хүндэ нүхэр олон,HH EE NG <SPACE> M O RJ I N D EH <SPACE> E Z EH NG <SPACE> O L EH NG <SPACE> HH EE NG <SPACE> H Us N D EH <SPACE> N Us H EH R <SPACE> O L EH NG,id_0_0642
643,0,холохон харгые эдэлһэн,H O L EH H EH NG <SPACE> H A R Gr Y J EH <SPACE> E D EH L HH EH NG,id_0_0643
644,0,аюул хүргэхэеэ байнал абынгаа нангин тоонтые,A J UUh L <SPACE> H Us R Gr EH H EH J EE <SPACE> B EE N EH L <SPACE> A V Y NG G AA <SPACE> N A NG GJ I NG <SPACE> T OOh N T Y J EH,id_0_0644
645,0,түрэһэн энхэ нютагшни,T Us R EH HH EH NG <SPACE> E N H EH <SPACE> NJ Uh T EH K SH NJ I,id_0_0645
646,0,шүүдэр сайруулһан үглөөгүүр,SH UUh D EH R <SPACE> S EE R UUh L HH EH NG <SPACE> Us G L OOs Gr UUs R,id_0_0646
647,0,гэмэрэжэ зэмэлэжэ нэгэ удаа хэлээгуй эжымни,G E M EH R EH ZH EH <SPACE> Z E M EH L EH ZH EH <SPACE> N E Gr EH <SPACE> Uh D AA <SPACE> H E L EE Gr UIs <SPACE> E ZH Y M NJ I,id_0_0647
648,0,хүхюун зугаа дэлгэрнэ тойроод,H Us HJ UUh NG <SPACE> Z Uh Gr AA <SPACE> D E L Gr EH R N EH <SPACE> T OE R OOh T,id_0_0648
649,0,эльгэ зурхэнээнь шархые,E LJ G EH <SPACE> Z Uh R H EH N EE NJ <SPACE> SH A R H Y J EH,id_0_0649
650,0,агуу тэрэ хун уран хундэ,A Gr UUh <SPACE> T E R EH <SPACE> H Uh NG <SPACE> Uh R EH NG <SPACE> H Uh N D EH,id_0_0650
652,0,эжы гуулэн ябахада хуугэдни баһал баяртайл,E ZH Y <SPACE> G UUh L EH NG <SPACE> J A V EH H EH D EH <SPACE> H UUh G EH D NJ I <SPACE> B A HH EH L <SPACE> B A J EH R T EE L,id_0_0652
653,0,зүрхэ сэдьхэлни доһолоод абаба,Z Us R H EH <SPACE> S E TJ H EH L NJ I <SPACE> D O HH EH L OOh T <SPACE> A V EH V EH,id_0_0653
654,0,нангин дуранайм охинши,N A NG GJ I NG <SPACE> D Uh R EH N EE M <SPACE> O HJ I N SH Y,id_0_0654
655,0,уула мэтэ орбойжо хада мэтэ ербыжэ,UUh L EH <SPACE> M E T EH <SPACE> O R V EE ZH EH <SPACE> H A D EH <SPACE> M E T EH <SPACE> J E R V Y ZH EH,id_0_0655
656,0,иимэ һанамжануудые мэдэн абабабди,II M EH <SPACE> HH A N EH M ZH EH N UUh D Y J EH <SPACE> M E D EH NG <SPACE> A V EH V EH B DJ I,id_0_0656
657,0,нүүдэлшэдэй замаар нэгэдүүлэгдэһэн соёл,N UUs D EH L SH EH D EE <SPACE> Z A M AA R <SPACE> N E Gr EH D UUs L EH G D EH HH EH NG <SPACE> S O J O L,id_0_0657
658,0,аргын бэдэрэн һургаалай удэр бури хуугэдээ урда,A R Gr Y NG <SPACE> B E D EH R EH NG <SPACE> HH Uh R Gr AA L EE <SPACE> Uh D EH R <SPACE> B Uh RJ I <SPACE> H UUh Gr EH D EE <SPACE> Uh R D EH,id_0_0658
659,0,арадай аман зохёол болон зохёолнууд,A R EH D EE <SPACE> A M EH NG <SPACE> Z O HJ OOh L <SPACE> B O L EH NG <SPACE> Z O HJ OOh L N UUh T,id_0_0659
660,0,гэрэй хажууда байһан харгы,G EH R EE <SPACE> H A ZH UUh D EH <SPACE> B EE HH EH NG <SPACE> H A R Gr Y,id_0_0660
661,0,залана торгон замбуулин,Z A L EH N EH <SPACE> T O R Gr EH NG <SPACE> Z A M B UUh LJ I NG,id_0_0661
662,0,жаргалтай гэр булэдоо байхытнээ хусэн,ZH A R Gr EH L T EE <SPACE> G EH R <SPACE> B Uh L EH D OOh <SPACE> B EE H Y T N EE <SPACE> H Uh S EH NG,id_0_0662
665,0,ухаан бодол хурсатай юм,Uh H AA NG <SPACE> B O D EH L <SPACE> H Uh R S EH T EE <SPACE> J Uh M,id_0_0665
666,0,шэнжэлбэб бадаржа байһан сэсэгые,SH E N ZH EH L V EH P <SPACE> B A D EH R ZH EH <SPACE> B EE HH EH NG <SPACE> S E S EH Gr Y J EH,id_0_0666
668,0,бурханаа бидэ мартан угы,B Uh R H EH N AA <SPACE> BJ I D EH <SPACE> M A R T EH NG <SPACE> Uh Gr Y,id_0_0668
669,0,россиин уран зохёолшодой холбооной гэшүүн,R O S SJ II NG <SPACE> Uh R EH NG <SPACE> Z O HJ OOh L SH EH D EE <SPACE> H O L V OOh N EE <SPACE> G E SH UUs NG,id_0_0669
670,0,хүбүүдэй нэгэниинь зугадаа,H Us V UUs D EE <SPACE> N E Gr EH NJ II NJ <SPACE> Z Uh Gr EH D AA,id_0_0670
671,0,эршэ хүсөөр элсүүлэнгүй яалайб,E R SH EH <SPACE> H Us S OOs R <SPACE> E L S UUs L EH NG G UIs <SPACE> J AA L EE P,id_0_0671
672,0,доро дохин унэн зурхэнһоо баяр хургэжэ,D O R EH <SPACE> D O HJ I NG <SPACE> Uh N EH NG <SPACE> Z Uh R H EH N HH OOh <SPACE> B A J EH R <SPACE> H Uh R Gr EH ZH EH,id_0_0672
673,0,һаруулхан одо мүшэдэй харгыгаар,HH A R UUh L H EH NG <SPACE> O D EH <SPACE> M Us SH EH D EE <SPACE> H A R Gr Y Gr AA R,id_0_0673
674,0,мүшэдэй туяанда мүлигдэн загсашаһан шулуун,M Us SH EH D EE <SPACE> T Uh J AA N D EH <SPACE> M Us LJ I G D EH NG <SPACE> Z A G S EH SH EH HH EH NG <SPACE> SH Uh L UUh NG,id_0_0674
675,0,газар дэлхэй гансалтайхан гэлсэдэг,G A Z EH R <SPACE> D E L H EE <SPACE> G A N S EH L T EE H EH NG <SPACE> G E L S EH D EH K,id_0_0675
676,0,би үүдэ хамаг хаажа орхеоб,BJ I <SPACE> UUs D EH <SPACE> H A M EH G <SPACE> H AA ZH EH <SPACE> O R HJ OOh P,id_0_0676
678,0,оюутан ябаһан үе сагни һанагдаа һэн,O J UUh T EH NG <SPACE> J A V EH HH EH NG <SPACE> Us J EH <SPACE> S A G NJ I <SPACE> HH A N EH G D AA <SPACE> HH EH NG,id_0_0678
679,0,хүнэй ямар абари зан танда тон сэнтэйб,H Us N EE <SPACE> J A M EH R <SPACE> A V EH RJ I <SPACE> Z A NG <SPACE> T A N D EH <SPACE> T O NG <SPACE> S E N T EE P,id_0_0679
680,0,буряад зон бултадаа байгал далайдаа дуратай,B Uh RJ AA T <SPACE> Z O NG <SPACE> B Uh L T EH D AA <SPACE> B EE Gr EH L <SPACE> D A L EE D AA <SPACE> D Uh R EH T EE,id_0_0680
681,0,арбан долоон наһа хүрэхэдөө,A R V EH NG <SPACE> D O L OOh NG <SPACE> N A HH EH <SPACE> H Us R EH H EH D OOs,id_0_0681
682,0,арай хатуу тоглоһон юм,A R EE <SPACE> H A T UUh <SPACE> T O K L EH HH EH NG <SPACE> J Uh M,id_0_0682
683,0,үгы даа гансал буряадуудбди гэнэ бултадаа,Us Gr Y <SPACE> D AA <SPACE> G A N S EH L <SPACE> B Uh RJ AA D UUh D B DJ I <SPACE> G E N EH <SPACE> B Uh L T EH D AA,id_0_0683
684,0,хоер килограмм гурбан зуун арбан табан грамм,H O J EH R <SPACE> KJ I L O G R A M <SPACE> G Uh R V EH NG <SPACE> Z UUh NG <SPACE> A R V EH NG <SPACE> T A V EH NG <SPACE> G R A M,id_0_0684
685,0,би буряад хүнби би охрын элһэнби,BJ I <SPACE> B Uh RJ AA T <SPACE> H Us NG BJ I <SPACE> BJ I <SPACE> O R H Y NG <SPACE> E L HH EH NG BJ I,id_0_0685
686,0,хонгёо дуутай һургуулиин хонхо,H O NG GJ OOh <SPACE> D UUh T EE <SPACE> HH Uh R Gr UUh LJ II NG <SPACE> H O N H EH,id_0_0686
687,0,үргэлжэ һэрюун байдагыень һанагшаб,Us R Gr EH L ZH EH <SPACE> HH E RJ UUh NG <SPACE> B EE D EH Gr Y J EH NJ <SPACE> HH A N EH G SH EH P,id_0_0687
688,0,ууган ехэ бодолоо уураг һайхан хүсэлөө,UUh Gr EH NG <SPACE> J E H EH <SPACE> B O D EH L OOh <SPACE> UUh R EH K <SPACE> HH EE H EH NG <SPACE> H O S EH L OOs,id_0_0688
689,0,амар мэндэ тоонто нютагни,A M EH R <SPACE> M E N D EH <SPACE> T OOh N T EH <SPACE> NJ Uh T EH G NJ I,id_0_0689
690,0,угаараа дамжуулагдаһан бэлигтэй хатаршан,Uh Gr AA R AA <SPACE> D A M ZH UUh L EH G D EH HH EH NG <SPACE> B E LJ I K T EE <SPACE> H A T EH R SH EH NG,id_0_0690
691,0,гар татангуй хайрлаһан муртоо,G A R <SPACE> T A T EH NG G UIs <SPACE> H EE R L EH HH EH NG <SPACE> M Uh R T OOh,id_0_0691
692,0,үлгэн дэлхэйн хуби заяан дээрэнь табяатай,Us L Gr EH NG <SPACE> D E L H EE NG <SPACE> H Uh VJ I <SPACE> Z A J AA NG <SPACE> D EE R EH NJ <SPACE> T A VJ AA T EE,id_0_0692
693,0,багшадаа баяр хургэнэб энээхэн удэртэнь,B A G SH EH D AA <SPACE> B A J EH R <SPACE> H Uh R Gr EH N EH P <SPACE> E N EE H EH NG <SPACE> Uh D EH R T EH NJ,id_0_0693
694,0,алтан дэлхэй тойрон ябааб,A L T EH NG <SPACE> D E L H EE <SPACE> T OE R EH NG <SPACE> J A V AA P,id_0_0694
696,0,хун бухэнэй ябадал заһаржа,H Uh NG <SPACE> B Uh H EH N EE <SPACE> J A V EH D EH L <SPACE> Z A HH EH R ZH EH,id_0_0696
699,0,минии сэдьхэлым дулаална,MJ I NJ II <SPACE> S E TJ H EH L Y M <SPACE> D Uh L AA L N EH,id_0_0699
700,0,эсэгэнь далахайн харин эжынь хойтоголой,E S EH Gr EH NJ <SPACE> D A L EH H EE NG <SPACE> H A RJ I NG <SPACE> E ZH Y NJ <SPACE> H OE T EH Gr O L EE,id_0_0700
701,0,бидэ байн байн абаяа нэхэжэ,BJ I D EH <SPACE> B EE NG <SPACE> B EE NG <SPACE> A V EH J AA <SPACE> N E H EH ZH EH,id_0_0701
702,0,номгон далайн флодой сэрэгшэн,N O M Gr EH NG <SPACE> D A L EE NG <SPACE> F L O D EE <SPACE> S E R EH K SH EH NG,id_0_0702
705,0,наян нэгэн сулжээ харахан гэзэгэнь,N A J A NG <SPACE> N E Gr EH NG <SPACE> S Uh L ZH EE <SPACE> H A R EH H EH NG <SPACE> G E Z EH Gr EH NJ,id_0_0705
706,0,шутэдэг гансахан шутээнтэйб,SH Uh T EH D EH K <SPACE> G A N S EH H EH NG <SPACE> SH Uh T EE N T EE P,id_0_0706
707,0,эрхүүгэй зайн галнууд ялараа,E R H UUs Gr EE <SPACE> Z EE NG <SPACE> G A L N UUh T <SPACE> J A L EH R AA,id_0_0707
708,0,тэнсэлгүйгөөр гуниглан нойргүй хонодог болоо һэм,T E N S EH L Gr UIs Gr OOs R <SPACE> G Uh NJ I L Gr EH NG <SPACE> N OE R Gr UIs <SPACE> H O N EH D EH K <SPACE> B O L OOh <SPACE> HH E M,id_0_0708
709,0,угэ хэлэхэдэ буруу дулаад лэ хадуурдаг болоо,Uh Gr EH <SPACE> H EH L EH H EH D EH <SPACE> B Uh R UUh <SPACE> D Uh L AA T <SPACE> L EH <SPACE> H A D UUh R D EH K <SPACE> B O L OOh,id_0_0709
710,0,зүрхэнэйм дуунууд үерлэн урдаа,Z Us R H EH N EE M <SPACE> D UUh N UUh T <SPACE> Us J EH R L EH NG <SPACE> Uh R D AA,id_0_0710
711,0,сэдьхэлэйм уйлахые дуулангүй,S E TJ H EH L EE M <SPACE> UIh L EH H Y J EH <SPACE> D UUh L EH NG G UIs,id_0_0711
